{
  "timestamp": "example-value",
  "type": "example-value",
  "id": "example-value",
  "previousEventId": "example-value",
  "activityFailedEventDetails": "example-value",
  "activityScheduleFailedEventDetails": "example-value",
  "activityScheduledEventDetails": "example-value",
  "activityStartedEventDetails": "example-value",
  "activitySucceededEventDetails": "example-value",
  "activityTimedOutEventDetails": "example-value",
  "taskFailedEventDetails": "example-value",
  "taskScheduledEventDetails": "example-value",
  "taskStartFailedEventDetails": "example-value",
  "taskStartedEventDetails": "example-value",
  "taskSubmitFailedEventDetails": "example-value",
  "taskSubmittedEventDetails": "example-value",
  "taskSucceededEventDetails": "example-value",
  "taskTimedOutEventDetails": "example-value",
  "executionFailedEventDetails": "example-value",
  "executionStartedEventDetails": "example-value",
  "executionSucceededEventDetails": "example-value",
  "executionAbortedEventDetails": "example-value",
  "executionTimedOutEventDetails": "example-value",
  "mapStateStartedEventDetails": "example-value",
  "mapIterationStartedEventDetails": "example-value",
  "mapIterationSucceededEventDetails": "example-value",
  "mapIterationFailedEventDetails": "example-value",
  "mapIterationAbortedEventDetails": "example-value",
  "lambdaFunctionFailedEventDetails": "example-value",
  "lambdaFunctionScheduleFailedEventDetails": "example-value",
  "lambdaFunctionScheduledEventDetails": "example-value",
  "lambdaFunctionStartFailedEventDetails": "example-value",
  "lambdaFunctionSucceededEventDetails": "example-value",
  "lambdaFunctionTimedOutEventDetails": "example-value",
  "stateEnteredEventDetails": "example-value",
  "stateExitedEventDetails": "example-value",
  "mapRunStartedEventDetails": "example-value",
  "mapRunFailedEventDetails": "example-value"
}